5,Звернення ,"Віщування, 5 рівень [ритуал]",1 хвилина,На себе,"В, С, М (ладан і флакон зі святою або нечестивою водою)",1 хвилина,"Ви зв’язуєтеся зі своїм божеством або божественним представником і ставите до трьох запитань, на які можна відповісти «так» або «ні». Ви повинні поставити свої запитання до закінчення дії чарів. На кожне запитання ви отримуєте правильну відповідь. Божественні істоти не обов’язково всезнаючі, тому ви можете отримати відповідь «незрозуміло», якщо запитання стосується інформації, яка лежить за межами знань божества. У випадку, коли однослівна відповідь може ввести в оману або суперечити інтересам божества, Майстер може запропонувати натомість коротку фразу. Якщо ви використаєте чари двічі або більше, перш ніж закінчите наступний тривалий відпочинок, існує накопичувальний 25-відсотковий шанс для кожного використання після першого, що ви не отримаєте відповіді. Майстер робить кидок таємно.",Клірик
5,Звернення до природи   ,"Віщування, 5 рівень (ритуал)",1 хвилина,На себе,"В, С",Миттєво,"Ви ненадовго стаєте одним цілим з природою та здобуваєте знання про навколишню територію. На відкритому повітрі чари дають знання про землі в межах 3 миль. У печерах та інших природних підземних місцях радіус обмежений 300 футами. Чари не діють там, де природа замінена спорудами, наприклад, у містах та підземеллях. Ви миттєво отримуєте знання про три факти за вашим вибором про такі особливості місцевості: Наприклад, ви можете визначити місцеперебування могутнього невмерлого в цьому районі, основні джерела безпечної питної води та розташування будь-яких містечок поблизу.","Друїд, рейнджер"
8,Землетрус ,"Втілення, 8 рівень",1 дія,500 футів,"В, С, М (дрібка бруду, шматочок каменю і грудочка глини)","Концентрація, до 1 хвилини","Ви створюєте сейсмічне збурення в точці на землі, яку ви можете бачити в межах відстані. Поки діють чари, сильні поштовхи розколюють ґрунт в межах кола радіусом 100 футів і з центром у тій точці, а також струшують істот і конструкції, які знаходяться на поверхні в тій області. Земля в цій області стає важкопрохідною місцевістю. Кожна істота, що підтримує концентрацію, стоячи на землі, мусить зробити рятівний кидок Статури. У разі невдачі концентрація істоти переривається. Коли ви створюєте ці чари й у кінці кожного ходу, поки ви концентруєтеся, кожна істота на землі в цій області мусить зробити рятівний кидок Спритності. У разі невдачі істота збита з ніг. Ці чари можуть мати додаткові ефекти залежно від поверхні в області, яку визначив майстер. Тріщини. Тріщини покривають область дії чарів на початку вашого ходу, наступного після створення чарів. В цілому 1к6 таких тріщин відкриваються в місцях, обраних майстром. Кожна має глибину 1к10 × 10 футів, ширину 10 футів і простягається з одного краю області чарів до протилежного. Істота, що стоїть на місці, в якому відкривається тріщина, мусить зробити успішний рятівний кидок Спритності, інакше впаде всередину. Істота, яка зробила успішний ряткидок, переміщується разом із краєм тріщини, коли та відкривається. Тріщина, що відкривається під конструкцією, автоматично її руйнує (див. нижче). Конструкції. Поштовхи завдають 50 дробильних ушкоджень будь-якій конструкції на землі в області, коли ви створюєте ці чари, та на початку кожного вашого ходу, поки чари не завершаться. Якщо пункти здоров’я конструкції знижуються до 0, вона руйнується і потенційно завдає шкоди істотам поряд. Істота в межах відстані, яка дорівнює половині висоти будівлі, мусить здійснити рятівний кидок Спритності. У разі невдачі істота отримує 5к6 дробильних ушкоджень, вона збита з ніг і завалена уламками, що вимагає перевірки Сили (Атлетика) із КС 20 як дії, щоб вибратися. Майстер може встановити КС вищим або нижчим залежно від типу уламків. При успішному ряткидку істота отримує половину ушкоджень, не падає і не опиняється під завалом.","Друїд, заклинач, клірик"
3,Злиття з каменем   ,"Перетворення, 3 рівень (ритуал)",1 дія,Дотик Складові:,"В, С",8 годин,"Ви входите в кам’яний предмет або поверхню, достатньо велику, щоб повністю вмістити ваше тіло, зливаючи себе та все спорядження, що ви маєте при собі, із каменем на час дії чарів. Використовуючи своє переміщення, ви занурюєтеся в камінь у точці, до якої можете торкнутися. Ваша присутність не залишає видимих слідів і нічого, що можна виявити немагічними чуттями. Перебуваючи злитими із каменем, ви не можете бачити, що відбувається ззовні, і всі перевірки Мудрості (Увага), щоб прислухатися до оточення, ви робите з перешкодою. Ви усвідомлюєте плин часу і можете створювати на себе чари, поки перебуваєте в камені. Ви можете використовувати своє переміщення, щоб вийти з каменю, де ви в нього увійшли, і так завершити чари. Ви не можете переміщуватися інакше. Незначні фізичні пошкодження каменю не шкодять вам, але його часткова руйнація чи зміна його форми (до межі, коли ви більше не можете повністю в нього вміститися) виганяє вас і завдає вам 6к6 дробильних ушкоджень. Повне знищення каменю (або перетворення в іншу субстанцію) виганяє вас і завдає вам 50 дробильних ушкоджень. Коли вас вигнано, ви збиті з ніг у вільному просторі, найближчому до точки вашого входу в камінь.","Клірик, друїд"
0,Злісне глузування  ,"Зачарування, замовляння",1 дія,60 футів,В,Миттєво,"Ви виголошуєте серію образ, приправлених тонкими чарами, на істоту, яку ви бачите в межах відстані. Якщо ціль може чути вас (хоча їй не обов’язково розуміти вас), вона повинна зробити успішний рятівний кидок Мудрості, або отримає 1к4 ушкоджень психічною енергією та матиме перешкоду на наступний кидок атаки, який ця істота зробить до кінця свого наступного ходу. Ушкодження цих чарів зростають на 1к4, коли ви досягаєте 5 рівня (2к4), 11 рівня (3к4) та 17 рівня (4к4).",Бард
2,Зміна вигляду  ,"Перетворення, 2 рівень",1 дія,На себе,"В, С","Концентрація, до 1 години","Ви набираєте іншої форми. Створюючи ці чари, оберіть одну з наступних можливостей, ефекти якої триватимуть, поки діють чари. Поки чари тривають, ви можете завершити одну обрану можливість дією та скористатися привілеями іншої. Водне пристосування. Ви пристосовуєте своє тіло до водного середовища, відкриваючи зябра та відрощуючи перетинки між пальцями. Ви можете дихати під водою і набуваєте швидкості плавання, що дорівнює вашій звичайній швидкості. Зміна зовнішності. Ви змінюєте свою зовнішність. Ви вирішуєте, як будете виглядати, включно зі зростом, вагою, рисами обличчя, звучанням голосу, довжиною волосся, забарвленням та видатними особливостями, якщо такі є. Ви можете набути вигляду члена іншої раси, хоча ваша статистика не зміниться. Також ви не можете виглядати як істота іншого розміру, ніж ви є, і ваші загальні обриси залишаються такі самі; наприклад, якщо ви двоногий, ці чари не можуть зробити вас чотириногим. У будь-який момент, поки діють чари, ви можете дією знову змінити свою зовнішність таким самим чином. Природна зброя. Ви відрощуєте пазурі, ікла, шипи, роги чи іншу природну зброю за власним вибором. Ваші беззбройні удари завдають 1к6 дробильних, колотих або різаних пошкоджень відповідно до обраної природної зброї, і ви опанували бій беззбройними ударами. Нарешті, природна зброя є магічною, і ви здобуваєте бонус +1 до кидків атак та пошкоджень, коли атакуєте.","Заклинач, чарівник"
5,Зміна спогадів  ,"Зачарування, 5 рівень",1 дія,30 футів,"В, С","Концентрація, до 1 хвилини","Ви намагаєтеся змінити спогади іншої істоти. Одна істота, яку ви можете бачити, повинна зробити рятівний кидок Мудрості. Якщо ви б’єтеся з цією істотою, вона має перевагу на цей рятівний кидок. У разі невдачі ціль стає причарованою вами на час дії чарів. Причарована ціль недієздатна та не усвідомлює свого оточення, хоча досі чує вас. Якщо вона отримує будь-які ушкодження або стає ціллю інших чарів, ваші чари завершуються, і спогади істоти не зазнають змін. Поки триває це причарування, ви можете впливати на спогади істоти про подію, яку вона пережила за останні 24 години і яка тривала не довше 10 хвилин. Ви можете назавжди стерти спогади про цю подію, дозволити цілі пригадати подію з ідеальною чіткістю та точними деталями, змінити деталі спогаду про подію, або створити спогади про якусь іншу подію. Ви повинні говорити до цілі, щоб описати, як змінилися спогади, і вона повинна бути здатною розуміти вашу мову, аби змінені спогади вкорінилися. Її свідомість заповнює будь-які прогалини в подробицях, що ви описали. Якщо чари завершуються, перш ніж ви завершили опис змінених спогадів, спогади істоти не будуть змінені. В іншому випадку, змінені спогади зберігаються, коли завершуються чари. Змінені спогади не обов’язково впливають на поведінку істоти, особливо, якщо спогади суперечать природним нахилам істоти, її світогляду та переконанням. Нелогічні зміни спогадів, наприклад, вживлення спогадів про те, як істота насолоджувалася обливанням кислотою, зникне, можливо, як поганий сон. Майстер може вважати змінені спогади занадто безглуздими, щоб суттєво вплинути на істоту. Чари зняття прокляття чи більше відновлення, створені на істоту, відновлюють її справжні спогади. На вищих рівнях. Якщо ви створюєте ці чари з використанням чарунки 6 рівня або вищої, ви можете змінити спогади цілі про подію, яка відбулася до 7 днів тому (6 рівень), 30 днів тому (7 рівень), 1 рік тому (8 рівень), або в будь-який час у минулому (9 рівень).","Бард, чарівник"
5,Знання легенд  ,"Віщування, 5 рівень",10 хвилин,На себе,"В, С, М (ладан вартістю щонайменше 250 зм, який поглинається чарами, і чотири смужки слонової кістки, вартістю щонайменше 50 зм кожна)",Миттєво,"Назвіть або опишіть особу, місце або предмет. Чари нагадують вам короткий виклад значущих відомостей про названу сутність. Ці відомості можуть містити сучасні розповіді, забуті історії чи навіть таємні знання, які ніколи не були широко відомими. Якщо названа сутність не має легендарної важливості, ви не отримуєте жодної інформації. Чим більше інформації ви вже маєте про цю сутність, тим більш точну та детальну інформацію ви отримуєте. Інформація, яку ви дізнаєтеся, є точною, але може бути викладена образною мовою. Наприклад, якщо ви тримаєте в руках таємничу магічну сокиру, ці чари можуть надати вам інформацію на зразок такої: “Горе тому злодіянцю, чия рука торкнеться сокири, бо навіть руків’я її відсіче злу руку. Лише істинне Дитя Каменю, кохане й прихильне до Морадина, зможе пробудити істинну силу сокири, і тільки зі священним словом Рудноґ на вустах”.","Бард, клірик, чарівник"
3,Зняття проклять  ,"Перешкоджання, 3 рівень",1 дія,Дотик Складові:,"В, С",Миттєво,"Ваш дотик завершує дію всіх проклять, які впливають на одну істоту чи предмет. Якщо предмет - це проклята магічна річ, його прокляття залишається, але чари переривають налаштування власника на цей предмет, щоб його можна було видалити чи відкинути.","Клірик, паладин, чаклун, чарівник"
2,Зона правди   ,"Зачарування, 2 рівень",1 дія,60 футів,"В, С",10 хвилин,"Ви створюєте магічну зону, захищену від обману, у сфері радіусом 15 футів із центром у точці, яку ви обираєте в межах відстані. Поки чари не завершаться, істота, яка входить в область дії чарів уперше в свій хід чи починає хід у цій області, повинна зробити рятівний кидок Харизми. У разі невдачі істота не може навмисно сказати брехню, перебуваючи в області чарів. Ви знаєте результат рятівного кидка кожної істоти. Вражена істота знає про чари, і тому може уникати відповіді на запитання, на які вона зазвичай збрехала б. Така істота може ухилятися в своїх відповідях, поки перебуває у межах істини.","Бард, клірик, паладин"
9,Зупинка часу  ,"Перетворення, 9 рівень",1 дія,На себе,В,Миттєво,"Ви ненадовго зупиняєте плин часу для всіх, окрім себе. Для інших істоти час зупиняється, поки ви здійснюєте 1к4+1 ходів поспіль, і в цей час ви можете використовувати дії та переміщуватися, як звичайно. Ці чари завершуються, якщо одна з ваших дій у цей час, або створений вами ефект впливає на іншу істоту або предмет, який тримає при собі хтось крім вас. Крім того, чари завершуються, якщо ви переміщуєтеся далі 1000 футів від місця, де ви створили ці чари.","Заклинач, чарівник"
1,Зурочення ,"Зачарування, 1 рівень",1 дія,30 футів,"В, С, М (крапля крові)","Концентрація, до 1 хвилини","До трьох істот за вашим вибором, яких ви можете бачити в межах відстані, повинні зробити рятівний кидок Харизми. Щоразу, коли ціль, яка провалила ряткидок, робить кидок атаки або рятівний кидок до завершення цих чарів, ціль мусить кинути к4 та відняти число, що випало, від результату свого кидка атаки чи рятівного кидка. На вищих рівнях. Коли ви створюєте ці чари з використанням чарунки 2 рівня або вищої, ви можете націлитися на одну додаткову істоту за кожну чарунку вище першої.","Бард, клірик"
6,Зцілення ,"Втілення, 6 рівень",1 дія,60 футів,"В, С",Миттєво,"Виберіть істоту, яку ви можете бачити в межах відстані. Сплеск позитивної енергії омиває істоту, внаслідок чого вона відновлює 70 пунктів здоров’я. Ці чари також завершують ефекти сліпоти, глухоти та будь-яких інших хвороб, що діють на ціль. Ці чари не діють на конструктів та невмерлих. На вищих рівнях. Коли ви створюєте ці чари з використанням чарунки 7 рівня або вищої, обсяг зцілення зростає на 10 за кожну чарунку вище шостої.","Клірик, друїд"
4,Камяна шкіра ,"Перешкоджання, 4 рівень",1 дія,Дотик Складові:,"В, С, М (діамантовий пил вартістю щонайменше 100 зм, який поглинається чарами)","Концентрація, до 1 години","Ці чари перетворюють плоть згодної істоти, якої ви торкаєтеся, твердою, як камінь. Поки чари не завершаться, ціль має стійкість до немагічних дробильних, колотих та рубаних ушкоджень.","Друїд, рейнджер, заклинач, чарівник"
0,Кийок ,"Перетворення, замовляння",1 бонусна,Дотик Складові:,"В, С, М (омела, листок трилисника та палиця або посох)",1 хвилина,"Деревина палиці чи посоха, який ви тримаєте, наповнюється силою природи. Поки діють чари, ви можете використовувати свою чаротворчу здібність замість Сили для кидків атаки ближнього бою та завданих цими атаками ушкоджень від цієї зброї, і кістка ушкоджень зброї перетворюється на к8. Зброя також стає магічною, якщо ще не була такою. Чари завершуються, коли ви створюєте їх знову, або коли ви випускаєте зброю з рук.",Друїд
