1,Обплутування ,"З’явлення, 1 рівень",1 дія,90 футів,"В, С","Концентрація, до 1 хвилини","Чіпкі бур’яни та лози виростають із землі у 20-футовому квадраті, починаючи з точки у межах відстані. Поки діють чари, ці рослини перетворюють землю в цій області у важкопрохідну місцевість. Коли ви створюєте ці чари, істота в цій області мусить зробити успішний рятівний кидок Сили, або стане скутою через обплутування рослинами, поки чари не завершаться. Скута рослинами істота може використати свою дію для перевірки Сили проти КС Ваших чарів. При успіху вона звільняється. Коли чари закінчуються, вичаклувані рослини в’януть.",Друїд
5,Обітниця ,"Зачарування, 5 рівень",1 хвилина,60 футів,В,30 днів,"Ви віддаєте магічний наказ істоті, яку ви можете бачити в межах відстані, примушуючи її виконати якісь послуги або відмовитися від певних дій або активності залежно від вашого рішення. Якщо істота вас розуміє, вона повинна зробити успішний рятівний кидок Мудрості, інакше стане причарованою вами на час дії чарів. Поки істота вами причарована, вона отримує 5к10 ушкоджень психічною енергією кожен раз, коли діє, прямо порушуючи ваші інструкції, але не більше одного разу за день. На істоту, яка вас не розуміє, ваші чари не мають впливу. Ви можете віддати будь-який наказ за власним вибором, крім дій, які точно спричинять смерть. Як тільки ви віддаєте суїцидальний наказ, чари закінчуються. Ви можете завершити чари раніше, використавши дію, щоб скасувати їх. Зняття прокляття, велике відновлення чи бажання також завершують ці чари. На вищих рівнях.Коли ви створюєте ці чари з використанням чарунки 7 або 8 рівня, тривалість чарів збільшується до 1 року. Коли ви створюєте ці чари з використанням чарунки 9 рівня, чари тривають, поки не будуть завершені одними зі згаданих вище чарів.","Бард, друїд, клірик, чарівник, паладин"
1,Огидний сміх  ,"Зачарування, 1 рівень",1 дія,30 футів,"В, С, М (крихітні пиріжки й пір’їна, якою розмахують у повітрі)","Концентрація, до 1 хвилини","Вибрана вами істота, яку ви можете бачити в межах відстані, сприймає все до смішного кумедним і піддається нападам сміху, якщо ці чари впливають на неї. Ціль повинна зробити успішний рятівний кидок Мудрості або впаде, стаючи недієздатною, і не може підвестися, поки діють чари. Істота зі значенням Інтелекту 4 або менше не піддається чарам. У кінці кожного свого ходу та кожного разу, коли істота отримує ушкодження, вона може зробити повторний рятівний кидок Мудрості. Ціль має перевагу на цей рятівний кидок, якщо робить його через отримані ушкодження. У разі успіху чари завершуються.","Бард, чарівник"
3,Оживлений образ  ,"Ілюзія, 3 рівень",1 дія,120 футів,"В, С, М (трошки овечої вовни)","Концентрація, до 10 хвилин","Ви створюєте образ предмета, істоти чи якогось іншого видимого феномена, який може вміститися у 20-футовий куб. Образ з’являється у місці, яке ви можете бачити в межах відстані, та існує, поки діють чари. Він виглядає цілком реальним, включно зі звуками, запахами та температурою, відповідною до зображеної речі. Ви не можете створити достатньо жару чи холоду, щоб завдати ушкоджень, звук, достатньо голосний, щоб завдати ушкодження громом чи оглушити істоту, або запах, який призводить до нездужання істоти (подібно до смороду троглодитів). Поки ви залишаєтеся в межах відстані для ілюзії, ви можете використовувати дію, щоб змусити образ рухатися в будь-яке інше місце в межах відстані. Коли образ змінює розташування, ви можете змінити його вигляд так, щоб його переміщення виглядало природним. Наприклад, якщо ви створюєте образ істоти та переміщуєте його, ви можете змінити образ так, щоб він виглядав, ніби йде. Так само ви можете змусити ілюзію видавати різні звуки в різний час, наприклад, навіть змусити її підтримувати розмову. Фізична взаємодія із образом виявляє, що це ілюзія, оскільки речі можуть проходити наскрізь. Істота, що використовує дію для обстеження образу, може визначити, що це ілюзія, успішною перевіркою Інтелекту (Розслідування) проти КС ваших чарів. Якщо істота розпізнає ілюзію, вона може бачити крізь образ, і всі інші чуттєві якості образу слабнуть для цієї істоти. На вищих рівнях. Коли ви створюєте ці чари з використанням чарунки 6 рівня або вищої, чари тривають, доки не будуть розвіяні, та не потребують вашої концентрації.","Бард, заклинач, чаклун, чарівник"
5,Оживлення мерців  ,"Некромантія, 5 рівень",1 година,Дотик Складові:,"В, С, М (діамант вартістю щонайменше 500 зм, який поглинається чарами)",Миттєво,"Ви повертаєте до життя мертву істоту, до якої торкаєтеся, за умови, що вона була мертвою не довше 10 днів. Якщо душа істоти має бажання та свободу, щоб повернутися до тіла, істота повертається до життя із 1 пунктом здоров’я. Ці чари також нейтралізують будь-які отрути та лікують немагічні хвороби, які істота мала на час смерті. Але ці чари, однак, не видаляють магічні хвороби, прокляття та подібні ефекти; якщо їх не прибрати до створення чарів, ці ефекти починають діяти, коли істота повертається до життя. Ці чари не можуть повернути до життя невмерлу істоту. Ці чари закривають усі смертельні рани, але не відновлюють втрачені частини тіла. Якщо істота не має частин тіла чи органів, які є необхідними для виживання - наприклад, голови, - чари автоматично провалюються. Повернення з мертвих до життя є випробуванням. Ціль отримує штраф -4 на всі кидки атаки, рятівні кидки та перевірки здібностей. Щоразу, коли ціль завершує тривалий відпочинок, цей штраф зменшується на 1, доки не зникне.","Бард, клірик, паладин"
5,Оживлення предметів  ,"Перетворення, 5 рівень",1 дія,120 футів,"В, С","Концентрація, до 1 хвилини","Предмети оживають за вашою командою. Виберіть до 10 немагічних предметів у межах відстані, які ніхто не несе і не носить. Цілі середнього розміру вважаються двома предметами, цілі великого розміру - чотирма предметами, цілі величезного розміру вважаються вісьмома предметами. Ви не можете оживити предмет, розмір якого більший за “величезний”. Кожна ціль оживає і стає істотою під вашим контролем, доки тривають чари або доки їхні пункти здоров’я не зменшаться до 0. Бонусною дією ви можете віддати ментальний наказ створеній цими чарами істоті, якщо істота перебуває у межах 500 футів від вас (якщо ви контролюєте кількох істот, ви можете наказувати будь-якій із них або всім одночасно, віддаючи кожній істоті той самий наказ). Ви вирішуєте, яку дію виконуватиме істота і куди вона рухатиметься у свій наступний хід, або ж ви можете віддати загальний наказ, наприклад, вартувати певну кімнату або коридор. Якщо ви не віддаєте наказів, істота тільки захищається від ворожих істот. Щойно віддано наказ, істота продовжує виконувати його, поки задачу не буде виконано. Оживлений предмет - це конструкт із КЗ, пунктами здоров’я, атаками, Силою та Спритністю, визначеними його розміром. Його Статура складає 10, Інтелект та Мудрість 3, а Харизма складає 1. Його швидкість 30 футів; якщо у предмета немає ніг або інших кінцівок, які він міг би використовувати для пересування, він натомість має швидкість польоту 30 футів і може зависати. Якщо цей предмет надійно прикріплений на поверхні більшого предмтеа, наприклад, ланцюг, прикручений до стіни, його швидкість дорівнює 0. Він має сліпий зір із радіусом 30 футів, і не бачить далі цієї відстані. Коли пункти здоров’я оживленого предмета знижуються до 0, він повертається до початкової форми, і будь-які надмірні пошкодження також переносяться на початкову форму предмета. Якщо ви наказуєте предмету атакувати, він виконує одиничну атаку ближнього бою проти істоти в межах 5 футів від себе. Він завдає удару із бонусом атаки та дробильними пошкодженнями, визначеними його розміром. Ігромайстер може постановити, що конкретний предмет завдає колоті або рубані пошкодження на основі його форми. На вищих рівнях. Коли ви створюєте ці чари з використанням чарунки 6 рівня або вищої, ви можете оживляти два додаткові предмети за кожну чарунку вище п’ятої.","Бард, заклинач, чарівник"
0,Опір ,"Перешкоджання, замовляння",1 дія,Дотик Складові:,"В, С, М (мініатюрний плащ)","Концентрація, до 1 хвилини","Ви торкаєтеся однієї згодної істоти. Один раз, поки чари не завершаться, ціль може кинути к4 і додати число, яке випало, до одного рятівного кидка на свій вибір. Вона може здійснити кидок кістки перед або після здійснення рятівного кидка. Тоді чари завершуються.","Друїд, клірик"
5,Освячення ,"Втілення, 5 рівень",24 години,Дотик Складові:,"В, С, М (трави, олії та ладан вартістю щонайменше 1000 зм, які поглинаються чарами)",Доки не розвіють,"Ви торкаєтеся точки та наповнюєте область навколо неї святої (або нечестивою) силою. Область може мати радіус до 60 футів, і чари провалюються, якщо радіус включає область, що вже є під ефектом чарів освячення. Область чарів має наступні ефекти. По-перше, небожителі, стихійники, феї, погань і невмерлі не можуть увійти в область, і такі істоти не можуть причарувати, налякати або зробити одержимими істот всередині області. Будь-яка істота, причарована, налякана або одержима таким створінням, перестає бути причарованою, наляканою чи одержимою, коли входить в область. Ви можете виключити один або більше тип істот з цього ефекту. По-друге, ви можете прив’язати до області додатковий ефект. Виберіть ефект із наступного списку, або виберіть ефект, запропонований Майстром. Деякі з цих ефектів застосовуються до істот в області; ви можете визначити, чи ефект застосовується до всіх істот, до прихильників певного божества чи лідера, чи істот певного сорту, наприклад, орків або тролів. Коли істота, на яку має подіяти ефект чарів, входить в область уперше за свій хід або завершує там свій хід, вона повинна зробити рятівний кидок Харизми. У разі успіху істота ігнорує додатковий ефект, доки не вийде з області. Відвага. Уражених істот не можна налякати, поки вони в області. Темрява. Область наповнює темрява. Нормальне світло, а також магічне світло, створене чарами, рівень яких нижчий за рівень чарунки, якою ви створили ці чари, не можуть освітити область. Денне світло. Яскраве світло наповнює область. Магічна темрява, створена чарами, рівень яких нижчий, ніж чарунка, яку ви використали для створення цих чарів, не може загасити це світло. Захист від енергії. Уражені істоти в області мають стійкість до одного типу ушкоджень за вашим вибором, окрім дробильних, колотих чи рубаних. Вразливість до енергії. Уражені істоти в області мають вразливість до одного типу ушкожень за вашим вибором, окрім дробильних, колотих чи рубаних. Вічний відпочинок. Мертві тіла, поховані в цій області, неможливо зробити невмерлими. Міжвимірна перешкода. Уражені істоти не можуть переміщуватися чи мандрувати з використанням телепортації або міжвимірними чи міжплановими способами. Страх. Уражені істоти налякані, поки перебувають в області. Тиша. Жоден звук не може вийти з області, і жоден звук не може проникнути всередину. Мови. Уражені істоти можуть спілкуватися з будь-якими іншими істотами в області, навіть якщо вони не мають спільної мови.",Клірик
0,Отруйні бризки  ,"З’явлення, замовляння",1 дія,10 футів,"В, С",Миттєво,"Ви простягаєте руку до істоти, яку можете бачити в межах відстані, й із вашої долоні злітає подув згубного газу. Істота повинна зробити рятівний кидок Статури, або отримає 1к12 ушкоджень отрутою. Ушкодження цих чарів зростають на 1к12, коли ви досягаєте 5 рівня (2к12), 11 рівня (3к12) та 17 рівня (4к12).","Друїд, заклинач, чаклун, чарівник"
2,Охоронний звязок  ,"Перешкоджання, 2 рівень",1 дія,Дотик Складові:,"В, С, М (пара платинових каблучок вартістю щонайменше 50 зм кожна, які ви та ціль повинні носити, поки діють чари)",1 година,"Ці чари захищають істоту, якої ви торкаєтеся, і створюють містичний зв’язок між вами та ціллю на час дії чарів. Поки ціль перебуває у межах 60 футів від вас, вона отримує бонус +1 до КЗ та рятівних кидків, а також має стійкість до всіх ушкоджень. Також кожного разу, коли ціль отримує ушкодження, ви отримуєте таку саму кількість ушкоджень. Чари завершуються, якщо ваші пункти здоров’я знижуються до 0, або якщо ви та ціль опиняєтеся на відстані понад 60 футів одне від одного. Чари також завершуються, якщо їх створити знову на одну із пов’язаних істот. Ви також можете зупинити ці чари дією.",Клірик
